{
  "name": "Morgan Demo",
  "usernames": {"x": "morgan_demo"},
  "niche": "Operations for small studios",
  "audience": "Independent studio operators",
  "ideal_customer": "A studio owner improving client handoffs",
  "what_they_sell": "Workflow audits",
  "business_goals": ["Build trust with studio owners"],
  "content_goals": ["Share usable working notes"],
  "expertise": ["Client onboarding"],
  "career_history": ["Fictional studio operator used for software tests"],
  "proof_results": [],
  "stories": ["A missing handoff owner delayed requests"],
  "strong_opinions": ["Run workflows manually before automating"],
  "ownership_topics": ["Client handoffs"],
  "excluded_topics": ["Investment advice"],
  "platforms": ["x", "linkedin", "tiktok", "substack"],
  "posting_cadence": {"x": 3, "linkedin": 1},
  "desired_tone": "Clear, measured, practical",
  "writing_samples": ["A useful handoff names the next owner. Otherwise you're just moving the waiting room."],
  "top_posts": [],
  "articles_newsletters": [],
  "reference_creators": [],
  "cta_offer": "Ask about a workflow audit when relevant",
  "restrictions": ["Use fictional data in demos; redact client identities"],
  "category": "Studio operations",
  "promise": "Make the next action visible",
  "enemy": "Unowned handoffs",
  "beliefs": ["Proof comes from actual work"],
  "differentiator": "Working logs rather than abstract productivity advice",
  "content_pillars": ["Client handoffs", "Workflow documentation"],
  "supporting_topics": ["Questions from calls", "Manual automation checks"],
  "platform_roles": {"x": "Conversation and useful notes", "linkedin": "Professional operator lessons", "tiktok": "Demonstrations", "substack": "Guides and owned audience"}
}
